{
  "schema_version": "1.0",
  "app_version": "0.4.0",
  "scan_id": "0a1b2c3d-4e5f-4a6b-8c7d-9e0f1a2b3c4d",
  "scanned_at": "2026-10-03T14:02:11.4821930Z",
  "observation_start": "2026-10-02T14:02:11Z",
  "observation_end": "2026-10-03T14:02:11Z",
  "previous_case_id": "5f0c2a7e-3b1d-4c8a-9e21-7a4d0b6c1f02",
  "symptom": {
    "category": "pc_freeze",
    "description": "PC friert seit gestern mehrmals täglich ein, auch auf dem Desktop.",
    "reproduction_steps": null,
    "occurred_at": null
  },
  "hardware": {
    "windows_version": null,
    "windows_build": null,
    "architecture": null,
    "cpu": null,
    "ram_gb": null,
    "system_manufacturer": null,
    "system_model": null,
    "is_portable": null,
    "board_manufacturer": null,
    "board_model": null,
    "board_revision": null,
    "bios_version": null,
    "bios_date": null
  },
  "devices": [],
  "findings": [],
  "collection": {
    "hardware": "failed",
    "devices": "failed",
    "system_events": "truncated",
    "wlan_events": "unavailable"
  },
  "wow": null,
  "consent": {
    "privacy_notice_version": "2026-10-01.1",
    "accepted_at": "2026-10-03T14:06:30Z",
    "upload_approved": true,
    "external_ai_allowed": false
  }
}